ORGANIZATION,DISCIPLINE,EXP_BUDGET,ANNUAL_AUD,YOUTH,ADDRESS,ADDRESS_2,CITY,ZIP,COUNTY,STATE
Marine Library Association/Marine Community LibraryHistory Project,History,$997,0,,121 Judd Street,P.O. Box 85,Marine on St. Croix,55047,Washington,MN
Goodhue County Historical Society/History Center,History,"$408,268","6,415","1,160",1166 Oak St,,Red Wing,55066,Goodhue,MN
National Eagle Center,Other,"$1,276,309","104,316","29,785",50 Pembroke Ave,,Wabasha,55981,Minnesota,MN
Lake City Area Arts,Arts Multipurpose,"$4,675",310,60,,,Lake City,,Wabasha,MN
City of Moorhead Parks and Recreation/FacilitiesArts and Cultural Budget items only,Other," $490,409 ",0,, 324 South 24th Street ,,Moorhead,56560,Clay,MN
Concord Singers,Performing Arts,"$16,115","8,925","1,275", 1 N Minnesota St,PO Box 492,New Ulm,56073-0492,Brown,MN
One World Many Papers,Visual Arts & Architecture,"$78,940",200,50, 212 N 2nd St,PO Box 18568,Minneapolis,55401,Hennepin,MN
Isle Rec and Ed Center (IREC) Arts Project,Other,"$3,000","2,323",262, 610 Mille Lacs Ave,PO Box 921,Isle,56342,Mille Lacs,MN
Growing West SideArts Project,Other,"$4,961","6,000","3,000",1 George St E,PO Box 7082,Saint Paul,55107,Ramsey,MN
Carleton CollegeHistory Project,History,"$20,000",0,,1 North College Street,,Northfield,55057,Rice,MN
New Ulm Oktoberfest Arts Activities,Performing Arts,"$14,965 ",10000,,1 North Minnesota Street,PO Box 384,New Ulm,56073,Brown,MN
State Street Theater Company,Performing Arts,"$36,157","2,568",100,1 State St N,,New Ulm,56073,Brown,MN
Grant CountyArts Project,Other,"$13,022","5,500",500,10 2nd St NE,,Elbow Lake,56531,Grant,MN
Minnesota Childrens Museum,Arts Multipurpose,"$7,274,273","530,000","265,000",10 7th St W,,Saint Paul,55102,Ramsey,MN
Bell Museum of Natural HistoryU of MN,Other,"$2,640,328","175,971","39,038",10 Church Street SE,,Minneapolis,55455-0104,Hennepin,MN
City of MankatoArts Project,Other,"$7,940","10,000","3,000",10 Civic Center Plz,,Mankato,56002-3368,Blue Earth,MN
"Whittier Alliance, Festivals",Arts Multipurpose,"$324,040",,,10 East 25th Street,,Minneapolis,55404,Hennepin,MN
Hermann Monument Society,History,"$13,650","4,000",500,10 Monument St,,New Ulm,56073,Brown,MN
Itasca County Historical Society  ,History,"$150,450",0,,10 Northwest 5th Street #3a,,Grand Rapids,55744,Itasca,MN
Wells Historical Society,History,"$14,762",0,,"100 1st Ave NW, Wells",PO Box 43 ,Wells,56097,Fairbault,MN
Twin Cities Carifest,Arts Multipurpose,"$46,000","5,000","1,000",100 1st St S,,Minneapolis,55458,Hennepin,MN
Gooseberry Park Players,Performing Arts,"$78,700","2,600",800,100 22nd Avenue South,PO Box 362,Moorhead,56560,Clay,MN
International Festival of Burnsville,Arts Multipurpose,"$44,050","4,900","1,700",100 Civic Center Pkwy,,Burnsville,55337-3817,Dakota,MN
Riverblenders Chorus of Mankato,Performing Arts,"$5,400",450,100,100 Dublin Rd,,Mankato,56001,Blue Earth,MN
Le Sueur County Historical Society,History,$95,150,,100 E Minnesota Street,PO Box 123,Le Center,56057,Le Sueur,MN
Crow River Youth Choir,Performing Arts,"$3,830",160,80,100 Glen Street SW,PO Box 667,Hutchinson,55350,McLeod,MN
Minnesota Folklore Theater,Performing Arts,"$54,330","3,318",475,100 Highland Ave,,Walker,56484,Cass,MN
Hutchinson Community Video Network/HCVN,Media & Communications,"$151,664",0,0,100 Jefferson St SE,,Hutchinson,55350,McLeod,MN
Saint Louis CountyArts Project,Visual Arts & Architecture,"$20,000","7,500","2,500",100 N 5th Ave W,,Duluth,55802,St. Louis,MN
Singers Minnesota Choral Artists,Performing Arts,"$249,073","18,300",300,100 N Oxford St Ste 2,,Saint Paul,55104,Ramsey,MN
Sleepy Eye Area Historical Society and Restoration Project,History,"$17,354",250,50,100 Oak St NW,,Sleepy Eye,56085,Brown,MN
Proctor Area Historical Society,History,"$32,295",0,0,100 Pionk Drive,,Proctor,55810,St. Louis,MN
"Vasaloppet, Inc.",Visual Arts & Architecture,"$15,000","2,000",100,100 S Union St,PO Box 22,Mora,55051,Kanabec,MN
Underwood Community EducationArts Project,Other,"$2,650",340,110,100 Southern Ave,,Underwood,56586-7013,Otter Tail,MN
Heritage Park Neighborhood AssociationArts Project,Other,"$50,987",40,10,1000 Olson Memorial Hwy,,Minneapolis,55411,Hennepin,MN
Rushford Area Society of the Arts,Arts Multipurpose,"$13,400","1,340",120,1000 Pine Meadows Lane,PO Box 332,Rushford,55971,Fillmore,MN
Choral Arts Ensemble of Rochester,Performing Arts,"$263,966","10,296",446,1001 14th St NW,,Rochester,55901,Olmsted,MN
Honors Choirs of Southeast Minnesota,Performing Arts,"$653,582","14,300","5,000",1001 14th St NW,,Rochester,55901-2534,Olmsted,MN
Southeastern Minnesota Youth Orchestras,Performing Arts,"$164,871","2,657","1,573",1001 14th St NW,,Rochester,55901,Olmsted,MN
MDI Hired HandsArts Project,Other,"$7,760",200,0,1001 3rd St NW,,Cohasset,55721,Itasca,MN
"Range Center, Inc. SoHo Artists",Arts Multipurpose,"$21,970",39,0,1001 8th Ave NW,,Chisholm,55719-1148,St. Louis,MN
Stage North Theatre Company,Performing Arts,"$23,812","2,600",500,1001 Kingwood St,,Brainerd,56401,Crow Wing,MN
The Apollo Club,Performing Arts,"$120,262 ",1200,,1001 MN-7,P.O. Box 300541,Hopkins,55305,Hennepin,MN
RiverSong Music Festival,Performing Arts,"$146,188","4,340","1,500",1003 Les Kouba Parkway Northwest,PO Box 667,Hutchinson,55350,McLeod,MN
I Cantanti Chamber Choirs,Performing Arts,"$14,901",720,20,1003 Maple St,,Northfield,55057-2918,Rice,MN
Minnesota Discovery Center,History,"$1,806,833","25,215","3,311",1005 Discovery Dr,,Chisholm,55719,St. Louis,MN
Arts and Mentoring Project,Performing Arts,"$1,655",1,0,1006 5th Ave SW,,Pipestone,56164,Pipestone,MN
1006 Summit Avenue Society (Governors Mansion),History,"$18,899",0,0,1006 Summit Avenue,,Saint Paul,55105,Ramsey,MN
The SEAD Project,Arts Multipurpose,"$5,000",400,100,1007 W Broadway Ave,,Minneapolis,55411,Hennepin,MN
Edge of the Wilderness Community Center,Arts Multipurpose,"$157,140","2,481",571,101 2nd Ave,,Bigfork ,56628,Itasca,MN
Tri City United Community EducationArts Project,Other,"$2,060",125,25,101 2nd St NE,,Montgomery,56069-1529,Le Sueur,MN
Curtain Call Theatre,Performing Arts,"$37,100","2,900",700,101 2nd Street Northeast,PO Box 91,Montgomery,56069-0091,Le Sueur,MN
Mardag Foundation,History,"$584,350",0,,101 5th St E,Suite 2400,Saint Paul,55101,Hennepin,MN
Saint Paul Foundation (The),Other,"$498,500",,,101 5th St E #2400,,Saint Paul,55101,Ramsey,MN
Perham Center for the Arts,Arts Multipurpose,"$56,866","2,100",300,101 5th St NE,,Perham,56573,Otter Tail,MN
Bush Foundation,Other,"$300,000",0,,101 5th Street East #2400,,Saint Paul,55101,Ramsey,MN
Maple River Community EducationArts Project,Other,"$8,060",200,100,101 6th Avenue Southeast,PO Box 515,Mapleton,56065,Blue Earth,MN
F. R. Bigelow Foundation,Other,"$605,500",0,,101 Fifth St E,Suite 2400,Saint Paul,55101,Hennepin,MN
Thief River Falls Concert Series,Performing Arts,"$48,579",300,,101 Knight Ave S,PO Box 312,Thief River Falls,56701,Pennington,MN
City of MoraArts Project,Other,"$2,000","1,800",300,101 Lake St S,,Mora,55051,Kanabec,MN
Helping Hands OutreachArts Project,Other,"$15,411",441,50,101 Plymouth St,PO Box 293,Holdingford,56340,Stearns,MN
Mille Lacs County Historical Society/Depot Museum,History,"$290,445",0,0,101 South Tenth Avenue,,Princeton,55371,Mille Lacs,MN
Hopkins Historical Society/Hopkins Activity Center,History,"$56,969","3,030",30,1010 1st Street S,,Hopkins,55343,Hennepin,MN
Prairie Piecemakers Quilt Guild,Visual Arts & Architecture,"$7,500",960,10,1010 Center St,,New Ulm,56073,Brown,MN
Salvation Army Harbor Light CenterArts Project,Other,"$27,477",30,0,1010 Currie Ave N,,Minneapolis,55403,Hennepin,MN
Visual Arts Minnesota,Visual Arts & Architecture,"$64,221",729,229,1010 W St Germain St,PO Box 972,Saint Cloud,56302,Stearns,MN
West Broadway Business and Area CoalitionArts Project,Other,"$31,200","5,000","1,000",1011 Broadway Ave W,,Minneapolis,55411,Hennepin,MN
"Milkweed Editions, Inc.",Literary & Arts,"$1,803,733","368,426","92,106",1011 Washington Ave S,,Minneapolis,55415-3015,Hennepin,MN
The Loft Literary Center,Literary & Arts,"$2,170,763","30,000","10,000",1011 Washington Ave S,,Minneapolis,55415-1278,Hennepin,MN
Minnesota Center for Book Arts,Visual Arts & Architecture,"$996,608","81,311","39,028",1011 Washington Ave S,,Minneapolis,55415-1279,Hennepin,MN
Open Book/Minnesota Book and Literary Arts Building,Literary & Arts,"$720,594","144,000",,1011 Washington Avenue South Suite 200,,Minneapolis,55415,Hennepin,MN
Prairie Arts Continuum,Performing Arts,"$31,800","1,551",331,1012 Fifth Avenue,PO Box 6,Windom,56101,Cottonwood,MN
Rock County Fine Arts Association,Visual Arts & Architecture,"$4,205",185,35,1013 150th Ave,,Luverne,56156-4206,Rock,MN
Magic Smelt Puppet Troupe,Performing Arts,"$10,500",750,350,1014 Lake Ave S,,Duluth,55802,St. Louis,MN
Alive and Kickin,Performing Arts,"$196,416","5,120",120,1015 4th Ave N,,Minneapolis,55405,Hennepin,MN
"Friends of St. Rose, Inc.History Project",History,"$6,859",0,,10155 505th Street,,Kenyon,55946,Goodhue,MN
Echoes of Peace Choir,Performing Arts,"$13,000",450,100,1018 Bong Blvd,PO Box 3076,Duluth,55803,St. Louis,MN
"Pine River Area Foundation, Inc.",Visual Arts & Architecture,"$7,965","1,230",300,102 Barclay Ave W,,Pine River,56474,Cass,MN
"Heritage Group North, Inc.",History,"$3,659",0,,102 Barclay Avenue,PO Box 266,Pine River,56474,"Cass, Crow Wing",MN
Clinton Depot,History,"$2,000",200,0,102 Center St,,Clinton,56278,Big Stone,mn
Polish Cultural Institute,History,"$77,931",0,,102 Liberty Street,,Winona,55987,Winona,MN
Thief River Falls Chamber of CommerceArts Project,Other,"$12,443","3,700","1,000",102 Main Ave N,,Thief River Falls,56701,Pennington,MN
"Keane Sense of Rhythm, Inc.",Performing Arts,"$193,494","3,540","2,130",102 Rose Ave W,,Saint Paul,55117,Ramsey,MN
New Ulm Turnverein/Turner Hall/Murals Preservation Project,History,"$654,235",0,,102 South State Street,,New Ulm,56073,Brown,MN
Pine City Heritage Players,Performing Arts,"$15,124","1,200",300,1020 7th Ave SW,,Pine City,55063,Pine,MN
Twin City Model Railroad Museum,History,"$231,118",0,,"1021 Bandana Boulevard East, Suite 222",,Saint Paul,55108,Ramsey,MN
Boys and Girls Club of RochesterArts Project,Other,"$10,127",213,157,1026 Center St E,,Rochester,55904,Olmsted,MN
Myers Wilkins Community School CollaborativeArts Project,Other,"$35,720",990,265,1027 N 8th Ave E,,Duluth,55805,St. Louis,MN
Rochester Repertory Theatre,Performing Arts,"$115,345","3,221",25,103 7th St NE,,Rochester,55906,Olmsted,MN
City of MontevideoArts Project,Other,"$31,500","8,200","2,200",103 Canton Avenue,PO Box 517,Montevideo,56265,Chippewa,MN
Lanesboro Arts Center,Arts Multipurpose,"$506,614","30,100","1,450",103 Parkway Ave N,,Lanesboro,55949,Fillmore,MN
Live Music at Le Bon in Springfield,Performing Arts,"$3,580",200,50,103 S Hoyt Ave,,Springfield,56087,Brown,MN
The Yes NetworkArts Project,Other,"$13,500",74,50,1030 Fourth Street Southeast,PO Box 1042,Saint Cloud,56304,Stearns,MN
East Central MN Pride Festival,Performing Arts,"$7,324",410,60,1030 Southview Ave,,Braham,55006,Isanti,MN
"Freeborn County Historical Society/Museum, Library and Historical Village",History,"$219,267",0,,1031 Bridge Ave,,Albert Lea,56007,Freeborn,Mn
City of KarlstadArts Project,Other,"$1,850",195,20,"104 1st St S, Ste 100",PO Box 229,Karlstad,56732,Kittson,MN
Mankato TubaChristmas,Performing Arts,"$1,505",375,25,104 2nd St E,,Janesville,56048,Waseca,MN
"Calumet Players, Inc.",Performing Arts,"$31,644","1,100",400,104 E Main St,PO Box 194,Pipestone,56164,Pipestone,MN
Houston County Historical Society,History,"$66,087",0,,104 Historical Lane,,Caledonia,55921,Houston,MN
City of MahnomenArts Project,Other,"$15,649","1,200",300,104 Madison Ave W,,Mahnomen,56557,Mahnomen,MN
"Pipestone Performing Arts Center, Inc.",Performing Arts,"$87,940","13,000","3,000",104 Main St E,,Pipestone,56164-0100,Pipestone,MN
Regents of the U of M (Duluth Campus)History Project,History,"$7,000",0,,1049 University Dr, ,Duluth,55812,St. Louis,MN
"Prairie Lakes Regional Arts Council, Inc.",Other,"$215,131",0,,"105 22nd Avenue NE, Suite A",,Waseca,56093-2612,Waseca,MN
"Central Square, Inc.",Arts Multipurpose,"$140,718","4,350",350,105 2nd Ave NE,,Glenwood,56334-1226,Pope,MN
Lanesboro Historical Preservation Association,History,"$12,247",570,130,105 Parkway S,Po Box 245,Lansboro,55949,Fillmore,MN
"Twin Cities Chinese Dance Center, Inc.",Performing Arts,"$117,755",150,100,1057 Highway 96 West,PO Box 131114,Roseville,55113,Ramsey,MN
City of HinckleyArts Project,Other,"$10,000","3,450",450,106 1st Street SE,PO Box 366,Hinckley,55037,Pine,MN
Mahnomen County Historical Society/MuseumHistory Project,History,"$5,120",0,,106 NE Main Street,PO Box 123,Mahnomen,56556,Mahnomen,MN
Hmong Arts Enrichment Program Committee,Arts Multipurpose,"$15,000",70,50,1060 Earl St,,Saint Paul,55106,Ramsey,MN
"Partnership Resources, Inc.Arts Project",Other,"$15,685",24,12,1069 10th Ave SE,,Minneapolis,55414,Hennepin,MN
"Frederic Chopin Society, Inc.",Performing Arts,"$61,036 ",1502,,107 Pratt Street,PO Box 8131,Minneapolis,55419,Hennepin ,MN
Stevie Rays Theatre Company,Performing Arts,"$333,199",340,40,10700 Cambridge Ct,,Burnsville,55337,Dakota,MN
Twin Cities String Academy,Performing Arts,"$6,950",90,30,10705 40th Ave N,,Plymouth,55441,Hennepin,MN
South Central Minnesota Studio Art Tour,Visual Arts & Architecture,"$12,780","2,650",150,10754 Farrel Ave,,Northfield,55057,Rice,MN
Sherburne County Historical Society,History,"$267,155",0,,10775 27th Avenue SE,,Becker,55308,"Statewide, Sherburne",MN
City of Red Lake FallsArts Project,Other,"$13,835","2,500",500,108 2nd St SW,,Red Lake Falls,56750,Red Lake,MN
Lakeland Public Television/KAWE/KAWB/Northern Minnesota Public Television,Media & Communications,"$2,896,853",0,,108 Grant Avenue NE,,Bemidji,56601,Beltrami,MN
"Art of the Lakes Association, Inc.",Visual Arts & Architecture,"$86,600","2,070",70,108 Lake Ave S,,Battle Lake,56515,Otter Tail,MN
Friends of the Saint Paul Public LibraryArts Project,Literary & Arts,"$16,435",420,30,1080 Montreal Ave,,Saint Paul,55116,Ramsey,MN
City of BlaineArts Project,Arts Multipurpose,"$44,220","2,500","1,000",10801 Town Square Dr,,Blaine,55449,Anoka,MN
Northfield Union of Youth,Visual Arts & Architecture,"$21,766",614,564,109 6th St W,PO Box 481,Northfield,55057,Rice,MN
Marshall Area Fine Arts Council,Arts Multipurpose,"$115,870","5,249","4,964",109 N 3rd St,PO Box 531,Marshall,56258,Lyon,MN
Northwest Minnesota Arts Council,Other,"$214,366","4,000",,109 S Minneosta St,,Warren,56762-1428,Marshall,MN
Truman Historical Association,History,"$11,565",660,160,"109 W Ciro Street, PO Box 56",,Truman,56088,Martin,MN
Forte Fine Arts Academy,Performing Arts,"$77,709",585,335,10970 185th St W,,Lakeville,55044,Dakota,MN
Kensington Area Heritage Society,History,"$8,630",0,,11 Grand Avenue,P.O. Box 54,Kensington,56343,"Douglas, Grant, Pope, Stevens",MN
Eastern Carver County Schools Community EducationArts Project,Other,"$12,580","2,300","1,500",11 Peavey Rd,,Chaska,55318,Carver,MN
"Northern Lights Music Festival, Inc.",Performing Arts,"$353,979","2,830",530,11 S 4th St W,,Aurora,55705,St. Louis,MN
Art Buddies,Arts Multipurpose,"$147,419",350,300,110 5th St N,,Minneapolis,55403,Hennepin,MN
Mankato Area Community EducationArts Project,Other,"$9,229","2,854","1,158",110 Fulton St,,Mankato,56001,Blue Earth,MN
Mankato Area 77 Lancers Marching Band,Performing Arts,"$300,205","375,000","150,000",110 Fulton St,,Mankato,56001-2520,Blue Earth,MN
Merely Players Community Theatre,Performing Arts,"$105,527","5,000","1,000",110 Fulton St,,Mankato,56001,Blue Earth,MN
Saint Cloud Rotary Club’s Summertime by George,Arts Multipurpose,"$172,703 ",123630,,1101 7th Street South,,Saint Cloud,56301,Stearns,MN
North Pioneer Radio/KSRQ FM Northland Community and Tech College/ 90.1 Radio,Media & Communications,"$187,468","3,000",0,1101 Highway One East,,Thief River Falls,56701,Pennington,MN
Iny Asian Dance Theater,Performing Arts,"$118,110","5,213","2,213",1102 Earl St,,Saint Paul,55106,Ramsey,MN
New Rivers Press,Literary & Arts,"$3,500",550,0,1104 7th Ave S,,Moorhead,56563-0001,Clay,MN
Minnesota State UniversityMoorhead/Cheryl Nelson Losset Performing Arts Series,Arts Multipurpose,"$87,000","1,750",250,1104 7th Ave S,,Moorhead,56563-0002,Clay,MN
Minnesota State University Moorhead,Arts Multipurpose,"$124,850","1,900","1,200",1104 7th Ave S,,Moorhead,56560,Clay,MN
Minnesota State UniversityMoorhead/Department of Music Percussion Studio,Performing Arts,"$7,010",232,14,1104 7th Ave S,,Moorhead,56563-0002,Clay,MN
Minnesota State University Moorhead/Music Department,Performing Arts,"$3,000",445,75,1104 7th Ave S,,Moorhead,56563-0002,Clay,MN
Minnesota State University Moorhead/Planetarium,Visual Arts & Architecture,"$8,870","6,000","5,000",1104 7th Ave S,,Moorhead,56563,Clay,MN
East Side Freedom Library,Arts Multipurpose,"$177,689",27,20,1105 Greenbrier St,,Saint Paul,55106,Ramsey,MN
Les Jolies Petites School of Dance,Performing Arts,"$62,521",360,60,1106 Broadway Ave W,,Minneapolis,55411,Hennepin,MN
Absolute Theatre,Performing Arts,"$35,200","1,000",0,1108 6th Ave NW,,Rochester,55901,Olmsted,MN
Sons of Norway Snorre Lodge 70Arts Project,Other,"$15,069",476,56,11094 195th Ave NE,,Thief River Falls,56701,Pennington,MN
Hutchinson Public Arts Commission,Visual Arts & Architecture,"$25,000","7,000","1,000",111 Hassan St SE,,Hutchinson,55350,McLeod,MN
Kaddatz Galleries,Visual Arts & Architecture,"$287,731","1,100",600,111 Lincoln Ave W,,Fergus Falls,56537,Otter Tail,MN
Evansville Arts Coalition,Arts Multipurpose,"$6,240",118,8,111 Main St,,Evansville,56326,Douglas,MN
Badger Area Community Fund,Arts Multipurpose,"$30,000",45,25,111 Main St N,,Badger,56714,Roseau,MN
Bluff Country Artists Gallery,Visual Arts & Architecture,"$4,800",343,78,111 Main St W,,Spring Grove,55974,Houston,MN
Otter Tail County Historical Society/Museum,History,"$835,023","17,487","3,346",1110 West Lincoln Avenue,,Fergus Falls,56537,Otter Tail,MN
Hopkins Center for the Arts,Arts Multipurpose,"$943,530","227,000","77,000",1111 Mainstreet,,Hopkins,55343,Hennepin,MN
"Stages Theatre Company, Inc.",Performing Arts,"$2,454,132","149,300","99,530",1111 Mainstreet,,Hopkins,55343,Hennepin,MN
Friends of the Minnesota Orchestra,Performing Arts,"$214,004","15,000","10,000",1111 Nicollet Mall,,Minneapolis,55403,Hennepin,MN
Minnesota Orchestral Association,Performing Arts,"$33,802,490","295,000","65,000",1111 Nicollet Mall,,Minneapolis,55403-2477,Hennepin,MN
Black Storytellers Alliance,Literary & Arts,"$50,070","2,150","1,650",1112 Newton Ave N,,Minneapolis,55411-3705,Hennepin,MN
Compass Rose Brass Ensemble,Performing Arts,"$4,500",17,0,11124 Quinn Ave S,,Bloomington,55437,Hennepin,MN
Full Moon Puppet Show,Performing Arts,"$16,180",475,25,1113 Thorn St,,Saint Paul,55106,Ramsey,MN
Promise Neighborhood of Central MinnesotaArts Project,Other,"$3,455",65,50,1114 9th Ave SE,PO Box 6082,Saint Cloud,56302,Sherburne,MN
Twin Cities Civil War Roundtable,History,"$26,897",667,0,1114 American Boulevard West,,Bloomington,55420,Hennepin ,MN
Rochester Arts and Culture Collaborative,Visual Arts & Architecture,"$19,800",200,50,1115 Foxcroft Ln SW,,Rochester,55902,Olmsted,MN
ArtReach,Arts Multipurpose,"$34,461","1,391",734,112 Bush St,,Red Wing,55066,Goodhue,MN
Heartland BIG ReadArts Project,Literary & Arts,"$7,875",800,300,112 Kamnic St,,Pierz,56364,Morrison,MN
Pierz Community EducationArts Project,Other,"$11,642",803,250,112 Kamnic St,,Pierz,56364-4000,Morrison,MN
East Central Regional Arts Council,Other,"$246,212",475,75,112 Main Ave S,,Braham,55006,Isanti,MN
"Northern Light Opera Company, Inc.",Performing Arts,"$84,024","2,100",378,112 Park Avenue,PO Box 102,Park Rapids,56470-4638,Hubbard,MN
Fergus Falls Public Arts Commision,Arts Multipurpose,"$42,050","13,250","3,250",112 Washington Ave W,,Fergus Falls,56537,Otter Tail,MN
City of Fergus FallsArts Project,Other,"$10,000","7,500","5,000",112 Washington Ave W,,Fergus Falls,56537,Otter Tail,MN
Cultural Awareness Organization/Worthington International Festival,Arts Multipurpose,"$39,205","3,200",500,1121 3rd Ave,,Worthington,56187,Nobles,MN
Ivey Awards,Performing Arts,"$195,486 ",0,,1128 Harmon Place  #305,,Minneapolis,55403-2004,Hennepin,MN
Alliance Française of the Twin Cities,Humanities,"$740,480",900,0,113 1st St N,,Minneapolis,55401,Hennepin,MN
Pipestone Civil War Days,Arts Multipurpose,"$35,985","3,184",610,113 Hiawatha Ave S,,Pipestone,56164,Pipestone,MN
Pipestone County Historical Society,History,"$243,622",0,,113 S Hiawatha Avenue,,Pipestone,56164,Pipestone,MN
New Ulm Suzuki School of Music,Performing Arts,"$70,972",330,80,113 S State St,PO Box 4,New Ulm,56073,Brown,MN
Saint Charles Community Education/Saint Charles Youth Theatre,Performing Arts,"$3,996",635,289,1136 Richland Ave,,Saint Charles,55972,Winona,MN
Columbia Heights Fine Arts Foundation,Performing Arts,"$5,495",200,25,1137 44 1/2 Ave NE,,Columbia Heights,55421,Anoka,MN
Southwest Minnesota Arts Council,Other,"$299,861",0,,114 N 3rd St,PO Box 55,Marshall,56258-1387,Lyon,MN
Wellcome Manor Family ServicesArts Project,Other,"$2,400",80,30,114 Pleasant St W,,Garden City,56034,Blue Earth,MN
City of GaryArts Project,Other,"$20,000","4,200","1,200",115 1st Ave,,Gary,56545,Norman,MN
Sounds of Spirit Lake,Performing Arts,"$14,280","3,370",300,115 2nd St NE,PO Box 376,Menahga,56464,Wadena,MN
Grant County Historical Society,History,"$44,500","1,407",,115 2nd St. NE,,Elbow Lake,56531,Grant ,MN
Duluth Childrens Museum,Other,"$608,064","32,328","18,231",115 S 29th Ave W,,Duluth,55806,Saint Louis,MN
Pipestone Indian Shrine Association,History,"$191,009",0,,115 Second St. NE,,Pipestone,56164,Pipestone,MN
Minnesota Masonic HomeArts Project,Other,"$12,000",70,20,11501 Masonic Home Dr,,Bloomington,55437,Hennepin,MN
Wilder Pageant,Performing Arts,"$15,000","5,000","2,000",11505 Crown Ave,PO Box 313,Walnut Grove,56180,Redwood,MN
City of Walnut Grove/Laura Ingals Wilder Pageant,Performing Arts,"$107,655 ",0,,11505 Crown Avenue,PO Box 313,Walnut Grove,56180,Redwood,MN
Franciscan Sisters of Little Falls,Performing Arts,"$284,524","3,800",800,116 8th Ave SE,,Little Falls,56345-3539,Morrison,MN
Rhythm of the River,Performing Arts,"$29,495","2,440",240,116 State Street,PO Box 84,Jackson,56143,Jackson,MN
Stevens County Historical Society,History,"$149,667",0,,116 W 6th Street,,Morris,56267,Stevens,MN
"Saint Marys University of Minnesota, Minnesota Conservatory for the Arts",Performing Arts,"$301,289","13,855","7,055",1164 10th St W,,Winona,55987,Winona,MN
High School for Recording Arts,Performing Arts,"$160,086","19,100","3,750",1166 University Ave W,,Saint Paul,55104,Ramsey,MN
Maple Grove Arts Center,Arts Multipurpose,"$138,669","6,500","1,500",11666 Fountains Dr,,Maple Grove,55369,Hennepin,MN
Deborah Elias Danza Espanola,Performing Arts,"$24,586","1,000",25,117 Mackubin St,,Saint Paul,55102,Ramsey,MN
Prairie Dance Alliance,Performing Arts,"$37,800","1,300",400,117 Park Ave,PO Box 83,Marshall,56258,Lyon,MN
Harmonic Relief,Performing Arts,"$18,368",660,60,1175 Gershwin Ave N,,Oakdale,55128,Washington,MN
JOYA! Chamber Music Series,Performing Arts,"$25,433",200,15,1179 Ravenswood St,,Shoreview,55126,Ramsey,MN
City of HanskaHistory Project,History,"$11,375",0,,118 Broadway,PO Box 91,Hanska,56041,Brown,MN
City of PetersonArts Project,Other,"$8,360",500,100,118 Fillmore Street,PO Box 67,Peterson,55962,Fillmore,MN
Wakemup Productions,Arts Multipurpose,"$15,000","2,000","1,000",1184 Mackubin St,,Saint Paul,55117,Hennepin,MN
Minnesota Genealogical Society,History,"$183,908",0,,"1185 Concord Street N, Suite 218",,South St. Paul,55075,Statewide,MN
City of SandstoneArts Project,Other,"$16,000",200,100,119 4th St,,Sandstone,55072-0641,Pine,MN
City of Elbow LakeArts Project,Other,"$7,840",288,88,119 Central Ave,,Elbow Lake,56531-1083,Grant,MN
Dangerous Productions Inc.,Performing Arts,"$31,915",350,50,1194 Seminary Ave,,Saint Paul,55104,Ramsey,MN
Olmsted County Historical Society,History,"$601,294","21,500",40,1195 West Circle Dr. SW,,Rochester,55902,Olmsted,MN
Ananya Dance Theatre,Performing Arts,"$174,901","3,810",70,1197 University Avenue West,PO Box 2427,Minneapolis,55402-0427,Hennepin,MN
City Center PartnershipArts Project/Sculpture Walk,Other,"$89,300","29,000","9,500",12 Civic Center Plz,,Mankato,56001,Blue Earth,MN
"Grand Marais Arts, Inc.",Visual Arts & Architecture,"$370,009","21,715",775,120 3rd Ave W,,Grand Marais,55604-0626,Cook,MN
"Lake Benton Opera House, Inc.",Performing Arts,"$49,026","7,750","2,950",120 Benton St E,,Lake Benton,56149,Lincoln,MN
Mankato Area Arts Council,Visual Arts & Architecture,"$178,428 ",0,,120 S Broad St,,Mankato,56001,Blue Earth,MN
Science Museum of Minnesota,Other,"$38,126,992","801,030","90,000",120 West Kellogg Boulevard,,Saint Paul,55102-1202,Ramsey,MN
Pioneer Public Television/KWCM/West Central MN Educational Television Co. ,Media & Communications,"$2,986,496","1,600",0,120 West Schlieman Ave,,Appleton,56208,Swift,MN
CentraCare Clinic Arts Residency,Performing Arts,"$5,174",36,12,1200 6th Ave N,,Saint Cloud,56303,Stearns,MN
College of Saint ScholasticaArts Project,Other,"$1,611,048","11,520","2,335",1200 Kenwood Ave,,Duluth,55811-4199,St. Louis,MN
Friends of Pine Grove Zoo,Other,"$337,857","36,916",,1200 West Broadway,,Little Falls,56345,Morrison,MN
Cantus,Performing Arts,"$1,208,994","29,948","2,650",1201 Marquette Ave,,Minneapolis,55403,Hennepin,MN
Bavarian Blast,Performing Arts,"$35,550","7,172","1,172",1201 North State Street,PO Box 911,New Ulm,56073,Brown,MN
KUMD University of MN Duluth,Media & Communications,"$190,235","34,536",0,1201 Ordean Court,,Duluth,55812,Saint Louis,MN
Twin Ports Wind Ensemble,Performing Arts,"$17,980",750,50,1201 Ordean Ct,,Duluth,55812,St. Louis,MN
